{
  "entries": [
    {
      "build_variants": [
        "release"
      ],
      "configured_targets": [
        "gfx101X-dgpu",
        "gfx101x"
      ],
      "family": "gfx101X-dgpu",
      "family_key": "gfx101x",
      "fetch_gfx_targets": [],
      "flags": {},
      "id": "nightly:gfx101x:windows",
      "observed_at": "2026-08-07T17:44:06Z",
      "platform": "windows",
      "runner": "",
      "runner_labels": [],
      "trigger": "nightly"
    },
    {
      "build_variants": [
        "release"
      ],
      "configured_targets": [
        "gfx103X-all",
        "gfx103x"
      ],
      "family": "gfx103X-all",
      "family_key": "gfx103x",
      "fetch_gfx_targets": [],
      "flags": {
        "nightly_check_only_for_family": true
      },
      "id": "nightly:gfx103x:windows",
      "observed_at": "2026-08-07T17:44:06Z",
      "platform": "windows",
      "runner": "windows-gfx1030-gpu-rocm",
      "runner_labels": [],
      "trigger": "nightly"
    },
    {
      "build_variants": [
        "release"
      ],
      "configured_targets": [
        "gfx1150"
      ],
      "family": "gfx1150",
      "family_key": "gfx1150",
      "fetch_gfx_targets": [],
      "flags": {},
      "id": "nightly:gfx1150:windows",
      "observed_at": "2026-08-07T17:44:06Z",
      "platform": "windows",
      "runner": "",
      "runner_labels": [],
      "trigger": "nightly"
    },
    {
      "build_variants": [
        "release"
      ],
      "configured_targets": [
        "gfx1152"
      ],
      "family": "gfx1152",
      "family_key": "gfx1152",
      "fetch_gfx_targets": [],
      "flags": {},
      "id": "nightly:gfx1152:windows",
      "observed_at": "2026-08-07T17:44:06Z",
      "platform": "windows",
      "runner": "",
      "runner_labels": [],
      "trigger": "nightly"
    },
    {
      "build_variants": [
        "release"
      ],
      "configured_targets": [
        "gfx1153"
      ],
      "family": "gfx1153",
      "family_key": "gfx1153",
      "fetch_gfx_targets": [],
      "flags": {},
      "id": "nightly:gfx1153:windows",
      "observed_at": "2026-08-07T17:44:06Z",
      "platform": "windows",
      "runner": "",
      "runner_labels": [],
      "trigger": "nightly"
    },
    {
      "build_variants": [
        "release"
      ],
      "configured_targets": [
        "gfx900"
      ],
      "family": "gfx900",
      "family_key": "gfx900",
      "fetch_gfx_targets": [],
      "flags": {},
      "id": "nightly:gfx900:windows",
      "observed_at": "2026-08-07T17:44:06Z",
      "platform": "windows",
      "runner": "",
      "runner_labels": [],
      "trigger": "nightly"
    },
    {
      "build_variants": [
        "release"
      ],
      "configured_targets": [
        "gfx906"
      ],
      "family": "gfx906",
      "family_key": "gfx906",
      "fetch_gfx_targets": [],
      "flags": {},
      "id": "nightly:gfx906:windows",
      "observed_at": "2026-08-07T17:44:06Z",
      "platform": "windows",
      "runner": "",
      "runner_labels": [],
      "trigger": "nightly"
    },
    {
      "build_variants": [
        "release"
      ],
      "configured_targets": [
        "gfx908"
      ],
      "family": "gfx908",
      "family_key": "gfx908",
      "fetch_gfx_targets": [],
      "flags": {},
      "id": "nightly:gfx908:windows",
      "observed_at": "2026-08-07T17:44:06Z",
      "platform": "windows",
      "runner": "",
      "runner_labels": [],
      "trigger": "nightly"
    },
    {
      "build_variants": [
        "release"
      ],
      "configured_targets": [
        "gfx90c"
      ],
      "family": "gfx90c",
      "family_key": "gfx90c",
      "fetch_gfx_targets": [],
      "flags": {},
      "id": "nightly:gfx90c:windows",
      "observed_at": "2026-08-07T17:44:06Z",
      "platform": "windows",
      "runner": "",
      "runner_labels": [],
      "trigger": "nightly"
    },
    {
      "build_variants": [
        "release"
      ],
      "configured_targets": [
        "gfx90a"
      ],
      "family": "gfx90a",
      "family_key": "gfx90a",
      "fetch_gfx_targets": [],
      "flags": {},
      "id": "postsubmit:gfx90a:windows",
      "observed_at": "2026-08-07T17:44:06Z",
      "platform": "windows",
      "runner": "",
      "runner_labels": [],
      "trigger": "postsubmit"
    },
    {
      "build_variants": [
        "release"
      ],
      "configured_targets": [
        "gfx1100",
        "gfx1101",
        "gfx1102",
        "gfx1103",
        "gfx110X-all",
        "gfx110x"
      ],
      "family": "gfx110X-all",
      "family_key": "gfx110x",
      "fetch_gfx_targets": [
        "gfx1100",
        "gfx1101",
        "gfx1102",
        "gfx1103"
      ],
      "flags": {
        "bypass_tests_for_releases": true
      },
      "id": "presubmit:gfx110x:windows",
      "observed_at": "2026-08-07T17:44:06Z",
      "platform": "windows",
      "runner": "windows-gfx110X-gpu-rocm",
      "runner_labels": [],
      "trigger": "presubmit"
    },
    {
      "build_variants": [
        "release"
      ],
      "configured_targets": [
        "gfx1151"
      ],
      "family": "gfx1151",
      "family_key": "gfx1151",
      "fetch_gfx_targets": [
        "gfx1151"
      ],
      "flags": {
        "nightly_check_only_for_family": true
      },
      "id": "presubmit:gfx1151:windows",
      "observed_at": "2026-08-07T17:44:06Z",
      "platform": "windows",
      "runner": "windows-gfx1151-gpu-rocm",
      "runner_labels": [],
      "trigger": "presubmit"
    },
    {
      "build_variants": [
        "release"
      ],
      "configured_targets": [
        "gfx1200",
        "gfx1201",
        "gfx120X-all",
        "gfx120x"
      ],
      "family": "gfx120X-all",
      "family_key": "gfx120x",
      "fetch_gfx_targets": [
        "gfx1200",
        "gfx1201"
      ],
      "flags": {
        "bypass_tests_for_releases": true,
        "nightly_check_only_for_family": true
      },
      "id": "presubmit:gfx120x:windows",
      "observed_at": "2026-08-07T17:44:06Z",
      "platform": "windows",
      "runner": "windows-gfx120X-gpu-rocm",
      "runner_labels": [],
      "trigger": "presubmit"
    }
  ],
  "generated_at": "2026-08-07T17:44:06Z",
  "schema_version": 1,
  "source": {
    "id": "therock-ci-matrix",
    "url": "https://raw.githubusercontent.com/ROCm/TheRock/main/build_tools/github_actions/amdgpu_family_matrix.py"
  }
}
